{
  "schema_version": "1.0",
  "request_id": "cozy_0001",
  "build_graph_id": "graph_cozy_village_v1",
  "world_profile": "cozy_cyber_pixel",
  "expected_world_revision": 0,
  "bounds": {
    "center": [
      0,
      0,
      0
    ],
    "size_m": [
      128,
      128,
      64
    ]
  },
  "nodes": [
    {
      "node_id": "house",
      "module_id": "cluster_cozy_house_small_A",
      "position": [
        -10,
        5,
        0
      ]
    },
    {
      "node_id": "greenhouse",
      "module_id": "cluster_cozy_greenhouse_droplet_A",
      "position": [
        10,
        5,
        0
      ]
    },
    {
      "node_id": "farm",
      "module_id": "cluster_cozy_farm_A",
      "position": [
        8,
        -12,
        0
      ]
    },
    {
      "node_id": "nori",
      "module_id": "char_nori7_base",
      "position": [
        0,
        -6,
        0
      ]
    }
  ],
  "edges": [],
  "generators": [
    {
      "generator_id": "gen_terrain_gentle_hills_v1",
      "parameters": {
        "seed": 123,
        "bounds": [
          100,
          100
        ]
      }
    },
    {
      "generator_id": "gen_road_network_v1",
      "parameters": {
        "seed": 123,
        "bounds": [
          100,
          100
        ]
      }
    },
    {
      "generator_id": "gen_village_layout_v1",
      "parameters": {
        "seed": 123,
        "bounds": [
          100,
          100
        ]
      }
    },
    {
      "generator_id": "gen_farm_layout_v1",
      "parameters": {
        "seed": 123,
        "bounds": [
          100,
          100
        ]
      }
    }
  ],
  "world_rules": [
    {
      "rule_id": "rule_day_night_v1",
      "config": {}
    },
    {
      "rule_id": "rule_crop_growth_v1",
      "config": {}
    }
  ],
  "manifestation": {
    "stages": [
      "WIREFRAME",
      "HOLOGRAM",
      "MATERIALIZING",
      "COMMITTING",
      "COMPLETE"
    ],
    "requires_confirmation": true
  },
  "validation": {
    "collision": true,
    "navigation": true,
    "style": true,
    "performance": true
  },
  "rollback": {
    "allowed": true,
    "mode": "COMPENSATING_MUTATION"
  }
}
